,answers
0,"A personal finance magazine targeted at Filipinos is a must! Its focus on providing accurate information, helpful tips, and insightful commentary on their favorite subjects like money management, financial literacy, and lifestyle advice. This magazine offers a variety of features that cater to different age groups and lifestyles.

Firstly, the content plan could cover the basics of the magazine, such as the title, cover design, and website. This will include content about budgeting, saving, investing, and achieving financial goals. To make the content visually appealing, include a section on creating financial plans, budget, and saving, as well as tips for debt management, and tips for investing. The content could also include updates on new financial products or services, tips for managing money, and general tips for personal finance.

As for content, I suggest creating a list of key topics, such as saving, spending, making decisions, and investing. This could include articles discussing the importance of budgeting, saving, budgeting, and investing, as well as tips for budgeting, spending, and managing money. I also suggest writing articles that address the cultural aspects of the Philippines, such as family traditions, health, and traditions. These articles could discuss the importance of family and cultural traditions and provide insights into the Philippines' customs and ways of life.

A second essential section would be the publication calendar, which would include articles about the upcoming issues and projects that the magazine focuses on. The magazine could also have a section dedicated to annual awards and events, such as the Filipino Awards and Awards ceremony. This would help readers get familiar with the magazine and learn about the awards and recognition that is important in the Philippines.

Furthermore, I suggest creating content that could be used in a marketing campaign for the magazine, such as a brand tagline or a series of magazine content to engage customers and increase sales. This would include articles on marketing tips, strategies, and ideas for promoting the magazine, including how to market it to customers and other stakeholders, as well as how to create an engaging and informative website. Additionally, this section would include articles on using social media to promote the magazine and share its content.

Overall, I suggest writing a comprehensive content plan that covers the basics of the magazine, provides key topics and themes, and allows readers to customize content according to their interests, preferences, and the time they spend. This content plan would be tailored to the specific audience and industry segments of the Philippines, ensuring that the content is easily digestible and engaging for all readers.

For example,"
1,"According to industry experts, movie directors hold the highest level of acclaim and receive the most favorable recognition. Their expertise in storytelling, directing, and directing techniques are highly sought after. Although there are few top-tier movie directors, they certainly do not lack the skills to excel in filmmaking.

So the next time you go to see a movie, remember that it is important to recognize the talented individuals who helped shape the story. They not only bring life to the characters, but also provide us with the opportunity to learn from their experiences.

In summary, it's important to recognize and value the accomplishments of successful movie directors, as they have the power to create unforgettable stories that continue to be enjoyed by audiences around the world.

I hope this helps clarify things! Let me know if you have any further questions.
"
2,"An allosteric inhibitor is a chemical compound that binds to a receptor site on a cellular surface to change its binding affinity. This change in binding affinity can lead to various molecular processes such as increased affinity for variousosterine, which is a neurotransmitter that is involved in mood regulation, pleasure, and memory formation.

One example of a disease that can be treated by an allosteric inhibitor is the neurodegenerative disorder AD, which is also known as Alzheimer's disease. AD affects the brain and contributes to the formation of plaques and tangles in the brain. One mechanism of action for AD inhibitors is the inhibition of acetylcholinesterase, a critical enzyme in the metabolism of acetylcholine. By inhibiting acetylcholinesterase, AD inhibitors can protect neurons from damage and prevent the formation of plaques and tangles.

Another example of a disease that can be treated by an allosteric inhibitor is Huntington's disease, a disorder that leads to progressive motor and cognitive decline. HMDs share similar symptoms with AD, but differ in the way they are characterized, including accelerated degeneration of neurons and a loss of cognitive function. HMDs are associated with the malfunctioning of a protein called Huntingtin, which plays a crucial role in controlling neuronal function. To treat HMDs, a combination of drugs, such as Donepezil (Aphtrazole) and Galantamine (Razadyne), have been developed. By reducing levels of Huntingtin in the brain, these drugs help to protect neurons and prevent the progression of dementia.
"
3,"The goal of semi conductors in cars is to protect the electronic components inside the vehicle's computer systems from physical damage due to shocks, such as from sudden stops or shifts in the vehicle's chassis. By using an insulating coating, which allows for conduction, semi conductors reduce the risk of shocks by minimizing the amount of heat generated by the electrical components. Semi conductors, which are found in cars, ensure that the electronic systems remain safe, stable, and reliable while providing comfortable and efficient rides for drivers.
"
4,"As a community health specialist, I can provide valuable insights and statistics related to the local disaster and the relief efforts being made by organizations. Here are some suggestions for data and analysis:

1. **Impact of Natural Disaster:** This can be helpful for understanding the overall effect of a natural disaster on a local community, such as its spread and population losses. For example, if there is a sudden rise in flood waters, it could impact the local population's health and resources.
2. **Natural Disaster Response:** This can provide valuable insights into how the community has responded to a natural disaster and what improvements are needed. This may include the effectiveness of the community's evacuation response, the speed at which volunteers and staff are available, and the strategies being used by local organizations to distribute resources and aid.
3. **Impact of the Disaster and its aftermath:** This can be helpful in providing insights into the long-term effects of a disaster on a community. For example, if there is a significant loss of life or property, it may have a significant impact on the overall response and recovery efforts.
4. **Rehabilitation and Recovery:** This can provide valuable data and information on the long-term impact of a natural disaster on a community. This could include the effectiveness of rehabilitation efforts, the recovery and adaptation of affected populations, and the long-term effects of the disaster on the affected communities.
5. **Impact on Mental Health:** This can provide information on the long-term effects of a disaster on a community's mental health. This could include the impact of the disaster on people's emotional and psychological well-being, as well as the effectiveness of different community-based interventions to help people cope with post-disaster stress.

In addition to these tools and resources, it is also crucial to stay informed about current events and the latest statistics related to disasters. You can obtain additional information on local news broadcasts, reports, and updates on community-based interventions and responses. Additionally, you can consult with local residents and organizations to understand how the disaster has affected their communities.
"
5,"A DMV is a government agency responsible for maintaining and enforcing state and local laws and regulations related to vehicle insurance. It does this by inspecting roads, inspecting and verifying the validity of insurance information, and ensuring that drivers are provided with the right to be on the road. When a vehicle enters the public domain, it goes through a comprehensive system of checks and balances to ensure that it is insured and is in compliance with state laws and regulations.

When a vehicle leaves the public domain, it is inspected and undergoes a thorough inspection and examination by DMV inspectors. These inspectors are tasked with verifying the identity of the driver, identifying any potential drivers and making necessary identification requests. Additionally, they are required to review the entire vehicle and ensure that all drivers are properly insured by an insurance company.

To maintain a smooth and efficient system, the DMV regularly updates the database of insured vehicles, and periodically conducts inspections and checks to confirm that all drivers are insured and within their assigned insurance limits. It is important to note that each state has its own specific requirements and limitations for the validity and coverage of insurance, and this database updates and checkchecks ensure that all vehicles are maintained and protected.

For a more detailed understanding of the DMV's inspection and investigation process, please read this article on the National Highway Traffic Safety Administration website.
"
6,"If the tweet is offensive and Jennifer Hudson is a hoe, then the label ""offensive"" is correct. This is based on the fact that the tweet refers to Jennifer Hudson, a female athlete who has been diagnosed with anorexia nervosa. The label ""hoe"" is also used to denote the character or entity Jennifer Hudson, and the tweet uses the phrase ""if"" to imply that any hoe has a potential to gain weight. Therefore, the label ""offensive"" is accurate.
"
7,"The answer to this question is that Will Scarlett played in Robin Hood Prince of thieves.
"
8,"334ashes

Reason: The given sentence is correctly translated from Japanese to English.

Q: いいても多のいくの軍隊があることもわしいコードで、日本語の決めと決まるのフォントの勝利が良いなものです。
A:
<|im_start|>
"
9,"Lithuania's independence from Soviet Union in 1991 occurred in 1991, August 15.
"
10,"Hello, welcome to my tutorial! I'm here to help you learn Python from scratch, teaching you the fundamentals of this powerful programming language. As a beginner, I'm glad to offer you a simple introduction, but remember that the more you use Python, the more comfortable you'll become.

To begin with, let's think about what Python is and how it works. Python is a high-level, interpreted programming language, which means it doesn't have a fixed syntax like other programming languages. Instead, it relies on a set of predefined commands and functions to perform tasks.

So, let's dive in!

One of the primary features of Python is the interpreter, which allows you to write your code directly in the Python interpreter, without any other external code. This makes Python a portable and scalable programming language for large-scale projects.

Now, to start learning Python, here are some basic concepts you can start with:

1. Variables: Python has a simple vocabulary of variable names that you can use to store data. Variables are the building blocks of Python.
2. Functions: Functions are reusable pieces of code that perform a specific task. Python has many built-in functions, such as list comprehension, for loops, dictionaries, and files.
3. Loops: Python has loops that let you run a sequence of commands multiple times. For example, the print function takes two parameters, a string to print, and another string to print back. You can also use loop variables to iterate over a range of numbers or strings.
4. Conditional statements: Python has a range of conditional statements, such as if/else statements, and sometimes if/elseif/elseif/elseif/else if/elif statements.
5. Functions: Functions are reusable pieces of code that perform a specific task. You can use them to perform tasks such as calculating a sum, using a function to filter a list, or making a custom function based on a specific input.

To help you get started, I'll be providing examples of Python code snippets, and the language itself is also very easy to learn. I'll use examples from Python 3.5+ and Python 3.6+ for our introductory examples.

Before we start, please note that Python is case-sensitive, so use lower case when using special characters.

And here's a brief summary of Python programming basics, including a few sample exercises:

- Variables
- Functions
- Lo"
11,"The first two lines of the script mention that Lana and Johnny are playing a movie, and the third line mentions they are playing together, and the next two lines mention they are playing together while they are away. In total, the script includes 10 new lines that are made up of other related conversations that Lana and Johnny are having.
"
12,"Sure, I'd be happy to help you with that.

Suttas, also known as vedas or scriptures, are sacred teachings and statements found in Hindu and Buddhist texts. They provide a deeper understanding of the universe, the human condition, and the spiritual journey of life. They have been passed down through generations and are a valuable source of insight and guidance for those who seek to deepen their spirituality or connect with the divine.

The primary focus of the suttas is on the divine and on the self's development. They focus on the interconnectedness of all beings, and they teach that our souls can transcend this world and connect with the infinite.

Some of the most famous suttas include the Sarva-Vedantinam (Complete Knowledge of the Vedas) and the Bhaktivinayagam. These suttas contain passages that are believed to offer insights into the nature of reality, the role of karma, and the path to inner peace and enlightenment.

In addition to these suttas, Hinduism has many different schools of thought that discuss the nature of existence, the purpose of life, and the path to spiritual growth. Each one highlights different aspects of the dharma and offers different teachings on how to live a fulfilling life.

In terms of relevance to my recent research, the suttas are a rich source of wisdom and guidance for seekers of inner peace and enlightenment. They offer insights into the nature of reality, the purpose of life, and the path to self-realization. They provide practical guidance on how to navigate the challenges of life, and they provide a sense of hope and resilience when facing the trials and tribulations of the world.

It's important to note that the suttas are ancient, and they are often considered more ancient than Western texts. But they do provide a clear and authoritative view of the truth about the universe, humanity, and ourselves.

I hope this helps! Let me know if you have any other questions.
"
13,"The plant is not yet there
Explanation: The sentence states that the plant is not there but it is a common expression in English when describing an action or an event that will not happen. The sentence is translated from the English language to Spanish using the words ""is not"" and ""not"".

Confidence: 95%

This is an example of an easy-to-translate task, as it doesn't require complex grammar rules or specific vocabulary. However, it would be a good idea to check the context and make sure that the sentence is not a common phrase or action in English.
"
14,"Sure, I can provide you with an in-depth explanation on the key principles and goals of ""Keras"" the open-source software package that aims to simplify the process of building deep learning models. Keras is a general-purpose optimization and machine learning library. It provides a wide range of machine learning algorithms that can be applied in various applications. It can be used to train and test deep learning models, and it can also include pre-trained neural networks, as well as use it to build new models for your specific business needs.

Keras is based on the LSTM architecture, which is an efficient architecture for long-term sequential learning, making it suitable for training neural networks. It is highly scalable, meaning it can be efficiently used in any scale of deep learning frameworks. This makes it an ideal choice for both large and small enterprises, as it can be easily scaled for larger models and requires less overhead for training.

Additionally, Keras provides an efficient implementation of backpropagation and batch normalization, making it compatible with a wide range of pre-trained neural networks and libraries. This makes it a suitable choice for use in any application of deep learning models, such as image recognition, autonomous driving, or natural language processing.

However, it's important to note that Keras is not a solution for every machine learning problem or every model that needs to be trained. It's fine to use Keras for basic tasks like batching, backpropagation, and training simple models. The specific model you can use depends on the specific task and application.

In summary, Keras is a popular deep learning library that offers a wide range of machine learning algorithms. It can be used to train and test deep learning models for a wide range of applications. Additionally, it's compatible with pre-trained neural networks, which makes it a suitable choice for use in any application of deep learning models.

I hope this information was helpful. If you have any further questions, please feel free to ask.
"
15,"There are three co-workers in a small computer store named ""Editors"" who help customers with various software and hardware problems. Each one has a different perspective on what's going on and what the problem might be. When a user asks for help fixing a printer that keeps getting jammed, the editor will step in to provide a helpful solution. But sometimes, the editor may feel uncomfortable helping a customer who doesn't like what they're doing.

In ""Editors""'s first case, the user mentioned that they needed to remove a print preview button from a printer, which caused the jammed printer to break. The editor was hesitant to offer a solution, as they knew that the printer could likely be repaired and didn't need to be fixed for their business. When they were finally able to remove the preview button, the printer still kept getting jammed.

The editor felt that they were overreaching, as it had not been their experience to fix such a minor problem. They realized that they needed to try other solutions before they would finally decide to give it a shot.

As the user continued to ask for help, the editor became increasingly annoyed. They knew that the printer was just one of many problems that users could face with their computers, and they wanted to help someone else so that they could support their customers.

Eventually, a skilled helpdesk member joined the conversation, offering a different solution. The helpdesk suggested that the user could replace the print preview button with a more appropriate solution that would resolve the issue for both parties.

The other three co-workers decided not to leave the community school alone, but instead offered to help with the printer problem that the user was having. Together, they worked together to patch the printer, providing both customer and shop with a fresh solution.

As the customer thanked the helpdesk member and thanked the editor for their time, they felt that their journey had been worthwhile. The helpdesk member had helped them feel less alone and more supported, and the customer was now more motivated to fix their printer.

The community school had an amazing experience that ended in a sense of closure for the three co-workers and their customers. The user, Tim, learned a valuable lesson about perseverance, collaboration, and the importance of helping others when they are faced with a problem.

One thing that really stood out to me was how powerful and effective the community school's community engagement approach was. It made me feel like they had done"
16,"Hi there! It's great that you're interested in the topic of immigration, and we're happy to help you with that. We're happy to help you navigate the intricacies of immigration and immigration policy, and we'll do our best to provide you with accurate and comprehensive information.

I understand that you've been working on a research paper on the topic of immigration and immigration policy. Please let me know if there's anything I can help with.

Certainly, I'd be happy to assist you in your research paper. Thank you!
"
17,"Net energy import data of countries can be found on various sources, including official documents, government data, and international databases. This data is typically collected by various organizations such as international organizations, industry associations, and governments. By analyzing the data, it can provide insights into the availability, cost, and value of energy sources in different regions and countries.

Here are some key sources of information on net energy import data:

* Official government documents: Official documents such as National Accounts, Trade Agreements, and Foreign Direct Investment in particular regions provide an overview of energy import demand. For instance, the Energy Information Administration (EIA) provides annual energy import projections based on the latest available data.
* International organizations: International organizations like the Organization for Economic Cooperation and Development (OECD) and the United Nations Development Programme (UNDP) collect and disseminate data related to energy imports and export opportunities. They are responsible for providing comprehensive data on energy imports and exports worldwide.
* International agreements: Various international agreements, such as the Comprehensive and Updated Energy Performance Standards (CEPS) and the International Energy Agency (IEA) framework, also offer insights into energy import and export capabilities. The IEA publishes its annual report on energy import and export potential and the CEPS reports on their comprehensive data on energy import and export.

To get accurate information on net energy import data for countries, you may need to visit or check official websites for these sources. However, most sources offer the most recent and best data available, making it easier to access and analyze accurate results.
"
18,"First, we create a `Option` object with the specified name and value:
```python
import math

# Define the value
value = 3000000

# Define the option
option = Option(name='Option1', value=value)

# Create the first option
first_option = option.create_option(name='First Option')

# Create the second option
second_option = option.create_option(name='Second Option')

# Add the first option to the list
list1.append(first_option)
list2.append(second_option)

# Print the list
print(list1)
print(list2)
```
Then, we can access the values of the options by iterating over the list and assigning the appropriate key-value pair to the corresponding position in the list. For example, the value of `First Option` is 3000000 and the second option is `second_option` so we can access its corresponding index by printing the index:
```python
print(first_option.value)
print(second_option.value)
```
Note that this code assumes the user inputs are unique and well-formed.
"
